{
  "schema_version": "broker_observation_report_mapping_matrix.v1",
  "matrix_id": "broker-observation-report-mapping.ib-tws.u3028269.adr0005-preacceptance",
  "account_id": "acct.ib.live.u3028269",
  "source_kind": "ib_tws_observation",
  "raw_secret_values_recorded": false,
  "command": {
    "enabled": false,
    "allowed_actions": []
  },
  "mappings": [
    {
      "callback_kind": "ib_tws.orderStatus",
      "target_report_type": "OrderStatusReport",
      "required_target_fields": [
        "report_id",
        "account_id",
        "instrument_id",
        "client_order_id",
        "venue_order_id",
        "order_status",
        "quantity",
        "filled_quantity",
        "remaining_quantity",
        "event_timestamp",
        "observed_timestamp",
        "received_timestamp",
        "sequence",
        "source_ref",
        "source_checksum",
        "raw_payload_provenance"
      ],
      "field_map": [
        {
          "target_field": "venue_order_id",
          "source_field_ref": "ib_tws.orderStatus.orderId",
          "semantics": "Broker venue order identity, preserved as observed identifier."
        },
        {
          "target_field": "order_status",
          "source_field_ref": "ib_tws.orderStatus.status",
          "semantics": "Broker order status normalized to Nautilus-compatible order status vocabulary."
        },
        {
          "target_field": "filled_quantity",
          "source_field_ref": "ib_tws.orderStatus.filled",
          "semantics": "Cumulative filled quantity observed from broker callback."
        },
        {
          "target_field": "remaining_quantity",
          "source_field_ref": "ib_tws.orderStatus.remaining",
          "semantics": "Remaining quantity observed from broker callback."
        },
        {
          "target_field": "avg_price",
          "source_field_ref": "ib_tws.orderStatus.avgFillPrice",
          "semantics": "Average fill price when broker provides it; null otherwise."
        },
        {
          "target_field": "sequence",
          "source_field_ref": "broker_observation.sequence",
          "semantics": "Durable observation sequence assigned before Account Mirror projection."
        }
      ],
      "provenance_fields": [
        "source_ref",
        "source_checksum",
        "raw_payload_provenance.payload_ref",
        "raw_payload_provenance.payload_checksum",
        "raw_payload_provenance.excerpt_redacted"
      ],
      "raw_payload_is_canonical": false
    },
    {
      "callback_kind": "ib_tws.execDetails_and_commissionReport",
      "target_report_type": "FillReport",
      "required_target_fields": [
        "report_id",
        "account_id",
        "instrument_id",
        "client_order_id",
        "venue_order_id",
        "trade_id",
        "last_px",
        "last_qty",
        "commission",
        "event_timestamp",
        "observed_timestamp",
        "received_timestamp",
        "sequence",
        "source_ref",
        "source_checksum",
        "raw_payload_provenance"
      ],
      "field_map": [
        {
          "target_field": "trade_id",
          "source_field_ref": "ib_tws.execDetails.execution.execId",
          "semantics": "Broker execution identity preserved as FillReport trade id."
        },
        {
          "target_field": "venue_order_id",
          "source_field_ref": "ib_tws.execDetails.execution.orderId",
          "semantics": "Broker order identity joined to the fill report."
        },
        {
          "target_field": "last_px",
          "source_field_ref": "ib_tws.execDetails.execution.price",
          "semantics": "Last execution price."
        },
        {
          "target_field": "last_qty",
          "source_field_ref": "ib_tws.execDetails.execution.shares",
          "semantics": "Last execution quantity."
        },
        {
          "target_field": "commission",
          "source_field_ref": "ib_tws.commissionReport.commission",
          "semantics": "Commission amount when broker commission callback is joined."
        },
        {
          "target_field": "sequence",
          "source_field_ref": "broker_observation.sequence",
          "semantics": "Durable observation sequence assigned before Account Mirror projection."
        }
      ],
      "provenance_fields": [
        "source_ref",
        "source_checksum",
        "raw_payload_provenance.payload_ref",
        "raw_payload_provenance.payload_checksum",
        "raw_payload_provenance.excerpt_redacted"
      ],
      "raw_payload_is_canonical": false
    }
  ],
  "raw_payload_policy": {
    "payload_ref_required": true,
    "payload_checksum_required": true,
    "excerpt_must_be_redacted": true,
    "browser_may_parse_raw_payload": false
  }
}
